{
  "format": "compiled-v1",
  "keyframes": [
    {
      "boost": 1.0,
      "label": "M0_Q0",
      "packedWords": [
        [
          51347,
          57794,
          13917,
          44668,
          19742
        ],
        [
          47674,
          55377,
          31771,
          39470,
          41252
        ],
        [
          52179,
          55377,
          36664,
          40302,
          41459
        ],
        [
          60654,
          55377,
          45884,
          43523,
          42309
        ],
        [
          57343,
          65535,
          57343,
          65535,
          57343
        ],
        [
          57343,
          65535,
          57343,
          65535,
          57343
        ]
      ],
      "stages": []
    },
    {
      "boost": 1.0,
      "label": "M100_Q0",
      "packedWords": [
        [
          51347,
          57794,
          13917,
          44668,
          19742
        ],
        [
          37629,
          55377,
          20318,
          39470,
          39534
        ],
        [
          59944,
          55377,
          45325,
          40302,
          42204
        ],
        [
          62369,
          55377,
          48400,
          43523,
          42928
        ],
        [
          57343,
          65535,
          57343,
          65535,
          57343
        ],
        [
          57343,
          65535,
          57343,
          65535,
          57343
        ]
      ],
      "stages": []
    },
    {
      "boost": 1.0,
      "label": "M0_Q100",
      "packedWords": [
        [
          51347,
          57794,
          12299,
          38258,
          17635
        ],
        [
          47674,
          55377,
          31782,
          33373,
          41259
        ],
        [
          52179,
          55377,
          36690,
          33958,
          41474
        ],
        [
          60654,
          55377,
          45920,
          37449,
          42350
        ],
        [
          57343,
          65535,
          57343,
          65535,
          57343
        ],
        [
          57343,
          65535,
          57343,
          65535,
          57343
        ]
      ],
      "stages": []
    },
    {
      "boost": 1.0,
      "label": "M100_Q100",
      "packedWords": [
        [
          51347,
          57794,
          12299,
          38258,
          17635
        ],
        [
          37629,
          55377,
          20200,
          33373,
          39434
        ],
        [
          59944,
          55377,
          45344,
          33958,
          42227
        ],
        [
          62369,
          55377,
          48458,
          37449,
          42975
        ],
        [
          57343,
          65535,
          57343,
          65535,
          57343
        ],
        [
          57343,
          65535,
          57343,
          65535,
          57343
        ]
      ],
      "stages": []
    }
  ],
  "name": "keep_smoke",
  "sampleRate": 39062.5
}