{
  "format": "compiled-v1",
  "keyframes": [
    {
      "boost": 1.0,
      "label": "M0_Q0",
      "packedWords": [
        [
          37209,
          57794,
          34756,
          57794,
          54762
        ],
        [
          37027,
          58614,
          29878,
          55377,
          50153
        ],
        [
          34756,
          57794,
          32236,
          56416,
          54308
        ],
        [
          22635,
          48705,
          38235,
          59145,
          65535
        ],
        [
          36249,
          57794,
          36249,
          57794,
          57343
        ],
        [
          62477,
          60415,
          59879,
          60415,
          54442
        ]
      ],
      "stages": []
    },
    {
      "boost": 1.0,
      "label": "M100_Q0",
      "packedWords": [
        [
          41936,
          57794,
          46497,
          57794,
          61815
        ],
        [
          38188,
          58614,
          33869,
          55377,
          52911
        ],
        [
          46497,
          57794,
          46367,
          53917,
          57151
        ],
        [
          51813,
          51341,
          51363,
          59145,
          56797
        ],
        [
          58137,
          57794,
          58355,
          55542,
          57525
        ],
        [
          62477,
          60415,
          59879,
          60415,
          54442
        ]
      ],
      "stages": []
    },
    {
      "boost": 1.0,
      "label": "M0_Q100",
      "packedWords": [
        [
          37209,
          57794,
          23829,
          51756,
          40891
        ],
        [
          37027,
          58614,
          17938,
          49562,
          35100
        ],
        [
          34756,
          57794,
          21632,
          50347,
          41044
        ],
        [
          21287,
          44668,
          27709,
          53578,
          60393
        ],
        [
          36249,
          57794,
          29766,
          51756,
          47598
        ],
        [
          62477,
          60415,
          61035,
          54635,
          52407
        ]
      ],
      "stages": []
    },
    {
      "boost": 1.0,
      "label": "M100_Q100",
      "packedWords": [
        [
          41936,
          57794,
          46401,
          51756,
          58446
        ],
        [
          38188,
          58614,
          30743,
          49562,
          46473
        ],
        [
          46497,
          57794,
          46481,
          47802,
          53983
        ],
        [
          51957,
          47324,
          51707,
          53578,
          53822
        ],
        [
          58137,
          57794,
          58694,
          49687,
          54549
        ],
        [
          62477,
          60415,
          61035,
          54635,
          52407
        ]
      ],
      "stages": []
    }
  ],
  "name": "first_sweep_180_to_2k6",
  "sampleRate": 39062.5
}